design/reviews/2026-11-13-sim-accuracy/warriors-70938/rend_pairs.csv

rep,g,spell,base,ap,lvl,tick,n,spread
3sdrcwdgo2yi,6B24DD,6548,11,782.0,26.0,26.0,1,0.0
3sdrcwdgo2yi,48CB91,6548,11,870.0,32.0,21.0,3,1.0
3sdrcwdgo2yi,7D7C84,6548,11,890.0,26.0,25.5,2,1.0
3sdrcwdgo2yi,7D7C84,6548,11,944.0,26.0,27.0,3,1.0
3sdrcwdgo2yi,7D7C84,6548,11,944.0,26.0,27.0,1,0.0
3sdrcwdgo2yi,7D7C84,6548,11,944.0,26.0,27.0,3,0.0
3sdrcwdgo2yi,7D7C84,6548,11,944.0,26.0,27.0,5,0.0
3sdrcwdgo2yi,7D7C84,6548,11,944.0,26.0,27.0,2,0.0
3sdrcwdgo2yi,7D7C84,6548,11,944.0,26.0,26.5,2,1.0
3sdrcwdgo2yi,7D7C84,6548,11,944.0,26.0,27.0,4,1.0
3sdrcwdgo2yi,7D7C84,6548,11,944.0,26.0,27.0,2,0.0
3sdrcwdgo2yi,7D7C84,6548,11,944.0,26.0,27.0,2,0.0
3sdrcwdgo2yi,7D7C84,6548,11,944.0,26.0,27.0,1,0.0
3sdrcwdgo2yi,7D7C84,6548,11,924.0,26.0,26.0,3,0.0
3sdrcwdgo2yi,7D7C84,6548,11,924.0,26.0,26.0,3,1.0
3sdrcwdgo2yi,7D7C84,6548,11,924.0,26.0,26.0,3,1.0
3sdrcwdgo2yi,7D7C84,6548,11,924.0,26.0,26.0,3,1.0
3sdrcwdgo2yi,7D7C84,6548,11,924.0,26.0,26.0,2,0.0
3sdrcwdgo2yi,6E998A,6548,11,965.0,29.0,25.0,3,1.0
3sdrcwdgo2yi,7D7C84,6548,11,924.0,26.0,26.0,1,0.0
3sdrcwdgo2yi,263190,6548,11,807.0,33.0,17.0,6,1.0
3sdrcwdgo2yi,263190,6548,11,734.0,33.0,16.0,1,0.0
3sdrcwdgo2yi,263190,6548,11,866.0,33.0,19.0,5,1.0
3sdrcwdgo2yi,263190,6548,11,787.0,33.0,18.0,2,0.0
3sdrcwdgo2yi,7D7C84,6548,11,951.0,26.0,27.0,4,0.0
3sdrcwdgo2yi,2398D6,6548,11,759.0,30.0,27.0,1,0.0
3sdrcwdgo2yi,91D84D,6546,7,246.0,4.0,10.0,1,0.0
3sdrcwdgo2yi,C02924,6548,11,598.0,28.0,25.0,4,2.0
3sdrcwdgo2yi,C02924,6548,11,544.0,28.0,24.0,2,0.0
3sdrcwdgo2yi,166ADF,6548,11,863.0,30.0,27.0,1,0.0
3sdrcwdgo2yi,93319C,6548,11,794.0,31.0,27.0,2,0.0
3sdrcwdgo2yi,554446,6548,11,665.0,32.0,17.0,6,0.0
3sdrcwdgo2yi,554446,6548,11,665.0,32.0,16.0,1,0.0
3sdrcwdgo2yi,48DBF6,6548,11,704.0,30.0,21.0,6,3.0
3sdrcwdgo2yi,43FE03,6548,11,710.0,28.0,24.0,1,0.0
3sdrcwdgo2yi,6948D2,6548,11,861.0,30.0,27.0,2,0.0
3sdrcwdgo2yi,6948D2,6548,11,861.0,30.0,27.0,1,0.0
3sdrcwdgo2yi,6948D2,6548,11,610.0,29.0,23.0,1,0.0
3sdrcwdgo2yi,69B2C0,6548,11,759.0,28.0,18.0,4,1.0
3sdrcwdgo2yi,6948D2,6548,11,837.0,30.0,23.0,1,0.0
3sdrcwdgo2yi,6948D2,6548,11,638.0,29.0,26.0,4,0.0
3sdrcwdgo2yi,6948D2,6548,11,837.0,30.0,26.0,1,0.0
3sdrcwdgo2yi,6948D2,6548,11,837.0,30.0,25.0,4,3.0
3sdrcwdgo2yi,731FFD,6548,11,894.0,33.0,20.0,4,0.0
3sdrcwdgo2yi,731FFD,6548,11,894.0,33.0,20.0,1,0.0
3sdrcwdgo2yi,50C0A1,6548,11,973.0,30.0,26.0,6,1.0
3sdrcwdgo2yi,50C0A1,6548,11,919.0,30.0,26.0,1,0.0
3sdrcwdgo2yi,554446,6548,11,665.0,32.0,17.0,4,0.0
3sdrcwdgo2yi,554446,6548,11,665.0,32.0,17.0,3,0.0
3sdrcwdgo2yi,554446,6548,11,665.0,32.0,17.0,5,1.0
3sdrcwdgo2yi,554446,6548,11,665.0,32.0,17.0,2,0.0
3sdrcwdgo2yi,554446,6548,11,665.0,32.0,16.0,1,0.0
3sdrcwdgo2yi,68039B,6548,11,958.0,35.0,22.0,2,0.0
3sdrcwdgo2yi,68039B,6548,11,818.0,35.0,20.0,6,1.0
3sdrcwdgo2yi,68039B,6548,11,873.0,35.0,20.0,6,2.0
3sdrcwdgo2yi,68039B,6548,11,873.0,35.0,20.0,4,3.0
3sdrcwdgo2yi,68039B,6548,11,873.0,35.0,20.0,3,1.0
3sdrcwdgo2yi,68039B,6548,11,873.0,35.0,20.0,3,1.0
3sdrcwdgo2yi,68039B,6548,11,873.0,35.0,20.0,4,1.0
3sdrcwdgo2yi,68039B,6548,11,873.0,35.0,20.0,1,0.0
3sdrcwdgo2yi,68039B,6548,11,873.0,35.0,21.0,5,1.0
3sdrcwdgo2yi,68039B,6548,11,873.0,35.0,20.0,6,3.0
3sdrcwdgo2yi,68039B,6548,11,873.0,35.0,20.0,6,1.0
3sdrcwdgo2yi,68039B,6548,11,873.0,35.0,20.0,5,1.0
3sdrcwdgo2yi,68039B,6548,11,873.0,35.0,20.0,4,1.0
3sdrcwdgo2yi,68039B,6548,11,873.0,35.0,20.0,6,1.0
3sdrcwdgo2yi,68039B,6548,11,889.0,35.0,20.0,6,1.0
3sdrcwdgo2yi,68039B,6548,11,889.0,35.0,21.0,5,1.0
3sdrcwdgo2yi,68039B,6548,11,889.0,35.0,21.0,5,1.0
3sdrcwdgo2yi,68039B,6548,11,889.0,35.0,21.0,4,2.0
3sdrcwdgo2yi,68039B,6548,11,889.0,35.0,20.5,6,1.0
3sdrcwdgo2yi,68039B,6548,11,889.0,35.0,20.0,3,1.0
3sdrcwdgo2yi,68039B,6548,11,889.0,35.0,21.0,1,0.0
3sdrcwdgo2yi,68039B,6548,11,889.0,35.0,20.0,3,1.0
3sdrcwdgo2yi,68039B,6548,11,889.0,35.0,20.0,3,1.0
3sdrcwdgo2yi,68039B,6548,11,889.0,35.0,21.0,6,1.0
3sdrcwdgo2yi,68039B,6548,11,889.0,35.0,20.0,3,1.0
3sdrcwdgo2yi,68039B,6548,11,889.0,35.0,21.0,1,0.0
3sdrcwdgo2yi,68039B,6548,11,889.0,35.0,20.5,4,1.0
3sdrcwdgo2yi,68039B,6548,11,889.0,35.0,20.0,5,1.0
3sdrcwdgo2yi,68039B,6548,11,889.0,35.0,21.0,6,1.0
3sdrcwdgo2yi,AFB05E,6548,11,725.0,31.0,19.0,2,0.0
3sdrcwdgo2yi,AFB05E,6548,11,725.0,31.0,18.0,5,1.0
3sdrcwdgo2yi,AFB05E,6548,11,946.0,31.0,20.0,6,0.0
3sdrcwdgo2yi,AFB05E,6548,11,735.0,31.0,17.5,4,1.0
3sdrcwdgo2yi,AFB05E,6548,11,761.0,31.0,19.0,3,1.0
3sdrcwdgo2yi,AFB05E,6548,11,761.0,31.0,19.0,1,0.0
3sdrcwdgo2yi,AFB05E,6548,11,761.0,31.0,19.0,6,2.0
3sdrcwdgo2yi,AFB05E,6548,11,761.0,31.0,19.0,4,0.0
3sdrcwdgo2yi,AFB05E,6548,11,727.0,31.0,19.0,5,1.0
3sdrcwdgo2yi,AFB05E,6548,11,727.0,31.0,18.0,1,0.0
3sdrcwdgo2yi,AFB05E,6548,11,938.0,31.0,17.0,2,0.0
3sdrcwdgo2yi,AFB05E,6548,11,727.0,31.0,19.0,5,1.0
3sdrcwdgo2yi,AFB05E,6548,11,727.0,31.0,19.0,1,0.0
3sdrcwdgo2yi,AFB05E,6548,11,727.0,31.0,19.0,1,0.0
3sdrcwdgo2yi,AFB05E,6548,11,743.0,31.0,19.0,3,0.0
3sdrcwdgo2yi,AFB05E,6548,11,743.0,31.0,19.0,2,0.0
3sdrcwdgo2yi,AFB05E,6548,11,743.0,31.0,19.0,1,0.0
3sdrcwdgo2yi,AFB05E,6548,11,743.0,31.0,18.0,6,1.0
3sdrcwdgo2yi,AFB05E,6548,11,689.0,31.0,18.0,2,0.0
3sdrcwdgo2yi,AFB05E,6548,11,743.0,31.0,19.0,2,0.0
3sdrcwdgo2yi,AFB05E,6548,11,743.0,31.0,19.0,2,0.0
3sdrcwdgo2yi,AFB05E,6548,11,743.0,31.0,19.0,4,0.0
3sdrcwdgo2yi,AFB05E,6548,11,741.0,31.0,19.0,2,0.0
3sdrcwdgo2yi,AFB05E,6548,11,764.0,31.0,19.0,5,0.0
3sdrcwdgo2yi,AFB05E,6548,11,764.0,31.0,19.0,3,0.0
3sdrcwdgo2yi,AFB05E,6548,11,764.0,31.0,19.0,3,0.0
3sdrcwdgo2yi,AFB05E,6548,11,764.0,31.0,19.0,5,0.0
3sdrcwdgo2yi,AFB05E,6548,11,764.0,31.0,18.0,1,0.0
3sdrcwdgo2yi,AFB05E,6548,11,764.0,31.0,19.0,3,0.0
3sdrcwdgo2yi,AFB05E,6548,11,764.0,31.0,19.0,2,0.0
3sdrcwdgo2yi,AFB05E,6548,11,764.0,31.0,19.0,3,0.0
3sdrcwdgo2yi,AFB05E,6548,11,764.0,31.0,18.5,6,2.0
3sdrcwdgo2yi,AFB05E,6548,11,710.0,31.0,18.0,6,0.0
3sdrcwdgo2yi,AFB05E,6548,11,710.0,31.0,18.0,1,0.0
3sdrcwdgo2yi,AFB05E,6548,11,764.0,31.0,19.0,3,0.0
3sdrcwdgo2yi,AFB05E,6548,11,764.0,31.0,19.0,6,0.0
3sdrcwdgo2yi,AFB05E,6548,11,764.0,31.0,19.0,6,0.0
3sdrcwdgo2yi,AFB05E,6548,11,764.0,31.0,19.0,3,0.0
3sdrcwdgo2yi,AFB05E,6548,11,764.0,31.0,19.0,2,0.0
3sdrcwdgo2yi,AFB05E,6548,11,764.0,31.0,19.0,2,0.0
3sdrcwdgo2yi,AFB05E,6548,11,743.0,31.0,19.0,3,1.0
3sdrcwdgo2yi,AFB05E,6548,11,743.0,31.0,19.0,4,0.0
3sdrcwdgo2yi,AFB05E,6548,11,743.0,31.0,19.0,2,0.0
3sdrcwdgo2yi,AFB05E,6548,11,743.0,31.0,19.0,3,0.0
3sdrcwdgo2yi,AFB05E,6548,11,743.0,31.0,19.0,6,0.0
3sdrcwdgo2yi,AFB05E,6548,11,743.0,31.0,19.0,3,0.0
3sdrcwdgo2yi,AFB05E,6548,11,743.0,31.0,19.0,2,0.0
3sdrcwdgo2yi,AFB05E,6548,11,743.0,31.0,19.0,4,0.0
3sdrcwdgo2yi,AFB05E,6548,11,936.0,31.0,18.0,1,0.0
3sdrcwdgo2yi,405AB4,6548,11,776.0,31.0,19.5,2,1.0
4q5el2xsgoy7,678B26,6547,9,722.0,20.0,17.5,4,1.0
4q5el2xsgoy7,DB4788,6548,11,524.0,28.0,20.0,6,1.0
4q5el2xsgoy7,DB4788,6548,11,524.0,28.0,21.0,5,1.0
4q5el2xsgoy7,DB4788,6548,11,575.0,28.0,22.0,1,0.0
ctxicu4cuyek,6B13AF,6548,11,823.0,25.0,26.0,3,1.0
ctxicu4cuyek,6B13AF,6548,11,823.0,25.0,25.0,1,0.0
ctxicu4cuyek,6B13AF,6548,11,823.0,25.0,25.0,1,0.0
ctxicu4cuyek,678B26,6547,9,722.0,20.0,17.5,4,1.0
ctxicu4cuyek,DB4788,6548,11,524.0,28.0,20.0,6,1.0
ctxicu4cuyek,DB4788,6548,11,524.0,28.0,21.0,5,1.0
ctxicu4cuyek,DB4788,6548,11,575.0,28.0,22.0,1,0.0
eygg26pg4gr2,2C0C7D,6548,11,914.0,34.0,21.0,1,0.0
eygg26pg4gr2,2C0C7D,6548,11,914.0,34.0,23.0,3,2.0
eygg26pg4gr2,530799,6548,11,837.0,29.0,28.0,2,0.0
eygg26pg4gr2,530799,6548,11,785.0,29.0,28.0,3,0.0
eygg26pg4gr2,530799,6548,11,837.0,29.0,28.0,4,0.0
eygg26pg4gr2,2AB63F,6548,11,964.0,27.0,27.0,3,0.0
eygg26pg4gr2,5909E7,6548,11,721.0,29.0,26.0,6,1.0
eygg26pg4gr2,D4CFD0,6548,11,883.0,28.0,26.0,5,0.0
eygg26pg4gr2,C3DC99,6547,9,629.0,24.0,20.0,1,0.0
eygg26pg4gr2,C3DC99,6547,9,629.0,24.0,20.0,1,0.0
eygg26pg4gr2,D4CFD0,6548,11,883.0,28.0,25.0,4,1.0
eygg26pg4gr2,166ADF,11572,14,1015.0,33.0,33.0,1,0.0
eygg26pg4gr2,D4CFD0,6548,11,958.0,28.0,27.5,4,1.0
eygg26pg4gr2,D4CFD0,6548,11,958.0,28.0,28.0,1,0.0
eygg26pg4gr2,D4CFD0,6548,11,958.0,28.0,28.0,3,0.0
eygg26pg4gr2,7BEE49,6548,11,944.0,28.0,27.0,3,0.0
gxrgvz4yzsi2,6AE447,6547,9,365.0,13.0,13.0,5,1.0
gxrgvz4yzsi2,290825,6547,9,444.0,21.0,14.0,1,0.0
gxrgvz4yzsi2,290825,6547,9,444.0,21.0,13.0,4,0.0
gxrgvz4yzsi2,290825,6547,9,444.0,21.0,13.0,2,0.0
gxrgvz4yzsi2,290825,6547,9,444.0,21.0,13.0,1,0.0
gxrgvz4yzsi2,70B763,6548,11,763.0,21.0,19.0,1,0.0
gxrgvz4yzsi2,70B763,6548,11,763.0,21.0,19.0,1,0.0
gxrgvz4yzsi2,70B763,6548,11,728.0,21.0,19.0,2,0.0
gxrgvz4yzsi2,70B763,6548,11,728.0,21.0,19.0,2,2.0
gxrgvz4yzsi2,70B763,6548,11,698.0,21.0,18.0,2,0.0
gxrgvz4yzsi2,70B763,6548,11,728.0,21.0,18.5,2,1.0
gxrgvz4yzsi2,70B763,6548,11,698.0,21.0,18.0,1,0.0
gxrgvz4yzsi2,70B763,6548,11,733.0,21.0,19.0,5,1.0
gxrgvz4yzsi2,70B763,6548,11,599.0,21.0,16.0,3,1.0
gxrgvz4yzsi2,70B763,6548,11,769.0,21.0,18.0,5,1.0
gxrgvz4yzsi2,70B763,6548,11,674.0,21.0,18.0,6,2.0
gxrgvz4yzsi2,70B763,6548,11,702.0,21.0,18.0,1,0.0
gxrgvz4yzsi2,70B763,6548,11,702.0,21.0,18.0,2,0.0
gxrgvz4yzsi2,70B763,6548,11,702.0,21.0,18.0,1,0.0
gxrgvz4yzsi2,70B763,6548,11,702.0,21.0,18.0,3,1.0
gxrgvz4yzsi2,70B763,6548,11,702.0,21.0,18.0,1,0.0
gxrgvz4yzsi2,70B763,6548,11,674.0,21.0,18.0,3,0.0
gxrgvz4yzsi2,70B763,6548,11,702.0,21.0,18.0,1,0.0
gxrgvz4yzsi2,70B763,6548,11,702.0,21.0,18.0,1,0.0
gxrgvz4yzsi2,70B763,6548,11,702.0,21.0,18.0,3,0.0
gxrgvz4yzsi2,70B763,6548,11,702.0,21.0,18.0,3,1.0
gxrgvz4yzsi2,70B763,6548,11,702.0,21.0,18.0,1,0.0
gxrgvz4yzsi2,70B763,6548,11,674.0,21.0,17.5,2,1.0
gxrgvz4yzsi2,70B763,6548,11,617.0,21.0,17.0,4,0.0
gxrgvz4yzsi2,70B763,6548,11,617.0,21.0,17.0,2,0.0
gxrgvz4yzsi2,70B763,6548,11,631.0,21.0,17.5,6,1.0
gxrgvz4yzsi2,70B763,6548,11,666.0,21.0,18.0,4,1.0
gxrgvz4yzsi2,70B763,6548,11,666.0,21.0,17.0,1,0.0
gxrgvz4yzsi2,70B763,6548,11,666.0,21.0,18.0,2,0.0
gxrgvz4yzsi2,70B763,6548,11,652.0,21.0,18.0,1,0.0
gxrgvz4yzsi2,70B763,6548,11,666.0,21.0,18.0,1,0.0
gxrgvz4yzsi2,70B763,6548,11,652.0,21.0,17.0,1,0.0
gxrgvz4yzsi2,70B763,6548,11,666.0,21.0,17.5,4,1.0
gxrgvz4yzsi2,70B763,6548,11,652.0,21.0,17.0,3,1.0
gxrgvz4yzsi2,70B763,6548,11,652.0,21.0,18.0,2,0.0
gxrgvz4yzsi2,70B763,6548,11,680.0,21.0,18.0,6,0.0
gxrgvz4yzsi2,70B763,6548,11,747.0,21.0,18.0,1,0.0
gxrgvz4yzsi2,70B763,6548,11,680.0,21.0,18.0,3,1.0
gxrgvz4yzsi2,70B763,6548,11,652.0,21.0,18.0,1,0.0
gxrgvz4yzsi2,70B763,6548,11,652.0,21.0,16.5,4,4.0
gxrgvz4yzsi2,4CFEE3,6547,9,562.0,20.0,15.0,1,0.0
gxrgvz4yzsi2,93A1A6,6548,11,555.0,28.0,18.0,3,1.0
gxrgvz4yzsi2,93A1A6,6548,11,555.0,28.0,18.0,1,0.0
gxrgvz4yzsi2,4CFEE3,6547,9,562.0,20.0,15.0,2,0.0
gxrgvz4yzsi2,70B763,6548,11,763.0,21.0,20.0,1,0.0
ju2t73py6pib,4EF9E7,11573,18,1109.0,44.0,41.0,5,1.0
z2opt2x2gs5u,5F5FE2,772,5,73.0,1.0,6.0,3,0.0
z2opt2x2gs5u,5B3C41,772,5,52.0,1.0,6.0,1,0.0
z2opt2x2gs5u,576CF0,772,5,85.0,1.0,6.0,2,0.0
z2opt2x2gs5u,613E08,772,5,102.0,1.0,7.0,1,0.0
z2opt2x2gs5u,62AB72,772,5,90.0,1.0,7.0,1,0.0
z2opt2x2gs5u,62AB72,772,5,90.0,1.0,7.0,3,1.0
z2opt2x2gs5u,62AB72,772,5,90.0,1.0,6.0,3,1.0
z2opt2x2gs5u,52B7ED,772,5,90.0,1.0,6.0,2,0.0
z2opt2x2gs5u,52B7ED,772,5,90.0,1.0,6.0,2,0.0
z2opt2x2gs5u,52B7ED,772,5,90.0,1.0,6.0,1,0.0
z2opt2x2gs5u,550552,772,5,83.0,1.0,6.0,3,0.0
z2opt2x2gs5u,52B7ED,772,5,90.0,1.0,6.0,3,0.0
z2opt2x2gs5u,550552,772,5,83.0,1.0,6.0,2,0.0
z2opt2x2gs5u,572351,772,5,90.0,1.0,6.0,1,0.0
z2opt2x2gs5u,550552,772,5,83.0,1.0,6.0,2,0.0
z2opt2x2gs5u,52B7ED,772,5,90.0,1.0,6.0,2,0.0
z2opt2x2gs5u,5E64D8,772,5,66.0,1.0,6.0,3,0.0
z2opt2x2gs5u,53068A,772,5,58.0,0.0,6.0,3,1.0
z2opt2x2gs5u,53068A,772,5,58.0,0.0,6.0,3,0.0
z2opt2x2gs5u,53068A,772,5,67.0,0.0,6.0,1,0.0

data/builds/1.60.1.70790/bis/rogue-combat.md

### Band 20 (gnome, 00000000000000000-3113030000000000000-000000000000000000)

Set DPS (verified): 45.7. Weights run: 6.3s. Verify run: 15.0s. 241 eligible items had no known source.

### Band 30 (gnome, 00000000000000000-3153030000012300000-000000000000000000)

Set DPS (verified): 76.1. Weights run: 6.4s. Verify run: 18.5s. 422 eligible items had no known source.

### Band 40 (gnome, 00000000000000000-3153030000012321511-000000000000000000)

Set DPS (verified): 137.3. Weights run: 6.9s. Verify run: 16.5s. 562 eligible items had no known source.

### Band 20 (undead, 00000000000000000-3113030000000000000-000000000000000000)

Set DPS (verified): 46.3. Weights run: 6.3s. Verify run: 14.0s. 240 eligible items had no known source.

### Band 40 (undead, 00000000000000000-3153030000012321511-000000000000000000)

Set DPS (verified): 138.3. Weights run: 6.9s. Verify run: 16.0s. 561 eligible items had no known source.